[
  {
    "mediumId": "med-public-address",
    "caseId": "institutional-sacrificial-escalation",
    "name": "Public political address",
    "mediumClass": "text",
    "description": "A public speech and its textual transmission.",
    "actorIds": [
      "actor-lincoln"
    ]
  },
  {
    "mediumId": "med-state-offices",
    "caseId": "institutional-sacrificial-escalation",
    "name": "State and military offices",
    "mediumClass": "office",
    "description": "Durable roles through which policy and command become effective.",
    "actorIds": [
      "actor-union-state"
    ]
  },
  {
    "mediumId": "med-commemoration",
    "caseId": "institutional-sacrificial-escalation",
    "name": "Commemorative practice",
    "mediumClass": "ritual",
    "description": "Ceremonial practices preserving and renewing interpretations of the dead.",
    "actorIds": [
      "actor-national-sacred-order"
    ]
  }
]
